{
  "$schema": "./external-mutations.schema.json",
  "schema_version": 1,
  "recorded_at": "2026-08-19",
  "repository": "songlab-cal/gpn",
  "applied": [
    {
      "id": "pypi-alpha-claim",
      "system": "pypi",
      "operation": "published the genuine gpn 0.9.0a1 package through Trusted Publishing",
      "targets": [
        "https://pypi.org/project/gpn/0.9.0a1/"
      ],
      "evidence": [
        "wheel sha256 0d50bf0e7fa408b10e6f8c34062da9c5023bb7e2bf0d257a940c61ef4feb9ff6",
        "sdist sha256 3f73be70efd6c61ea4cba650ef0153d8472e08bcb1889b4591c11d3675ae7caf"
      ]
    },
    {
      "id": "pypi-trusted-publisher-binding",
      "system": "pypi",
      "operation": "bound the gpn project to the repository release workflow through GitHub OIDC",
      "targets": [
        "PyPI project gpn",
        "GitHub owner songlab-cal",
        "GitHub repository gpn",
        "workflow release.yml",
        "environment pypi"
      ],
      "evidence": [
        "gpn 0.9.0a1 was published successfully without a long-lived PyPI token"
      ]
    },
    {
      "id": "alpha-release",
      "system": "github",
      "operation": "merged PR 80 and published prerelease v0.9.0a1",
      "targets": [
        "songlab-cal/gpn#80",
        "songlab-cal/gpn@v0.9.0a1"
      ],
      "evidence": [
        "release commit 637aaac",
        "the release workflow completed successfully"
      ]
    },
    {
      "id": "trusted-publisher-environment",
      "system": "github",
      "operation": "created the pypi environment used by the PyPI Trusted Publisher",
      "targets": [
        "songlab-cal/gpn:environment:pypi"
      ],
      "evidence": [
        "the environment exists with no deployment protection rule, avoiding a solo-maintainer deadlock"
      ]
    },
    {
      "id": "delete-merged-branches",
      "system": "github",
      "operation": "enabled automatic deletion of merged pull-request branches",
      "targets": [
        "songlab-cal/gpn:delete_branch_on_merge"
      ],
      "evidence": [
        "the 2026-08-19 repository API audit returned true"
      ]
    }
  ],
  "pending": [
    {
      "id": "merge-modernization-stack",
      "system": "github",
      "authorization": "explicit_final_maintainer_approval",
      "disposition": "approval_ready",
      "operation": "merge the approved component pull requests bottom-up and close the cumulative review pull request",
      "targets": [
        "songlab-cal/gpn:main",
        "songlab-cal/gpn#100"
      ],
      "source": "release/0.9.0/review.md",
      "preconditions": [
        "the body of cumulative PR 100 records the exact approved head and tree and the maintainer repeats both identifiers in the approval",
        "release/0.9.0/component-prs.json records the approved component PR order and immutable heads",
        "all required checks pass at the final stack tip",
        "the maintainer explicitly approves the cumulative diff and this ledger"
      ],
      "verification": [
        "main has the same tree as the approved cumulative tip",
        "all component pull requests preserve their reviewed topic boundaries"
      ],
      "failure_response": [
        "stop at the first conflict or changed tree and return the revised cumulative diff for review"
      ]
    },
    {
      "id": "protect-main",
      "system": "github",
      "authorization": "explicit_final_maintainer_approval",
      "disposition": "approval_ready",
      "operation": "create the active repository ruleset after its required contexts exist on main",
      "targets": [
        "songlab-cal/gpn:ruleset:Protect main"
      ],
      "source": "release/main-ruleset.json",
      "depends_on": [
        "merge-modernization-stack"
      ],
      "preconditions": [
        "the final CI workflow has reported all four required contexts named in release/main-ruleset.json on a pull request",
        "squash merging remains enabled",
        "no approval count or CODEOWNERS rule is added while there is one active maintainer"
      ],
      "verification": [
        "the ruleset targets only the default branch and has no bypass actors",
        "a direct push, force push, and branch deletion are blocked",
        "a green up-to-date PR with resolved conversations can be squash-merged by the maintainer"
      ],
      "failure_response": [
        "disable the ruleset through repository administration, record the reason, correct the payload through review, and re-enable it"
      ]
    },
    {
      "id": "enable-security-features",
      "system": "github",
      "authorization": "explicit_final_maintainer_approval",
      "disposition": "approval_ready",
      "operation": "enable Dependabot security updates, secret scanning, secret-scanning validity checks, and push protection",
      "targets": [
        "songlab-cal/gpn:security-and-analysis"
      ],
      "source": "release/governance-audit-2026-08-19.md",
      "depends_on": [
        "merge-modernization-stack"
      ],
      "preconditions": [
        "the merged tree removes the historical vulnerable manifest and pins the validated Transformers 5.15.0 runtime",
        "the repository plan supports the selected public-repository security features"
      ],
      "verification": [
        "the repository API reports each available feature enabled",
        "the three historical Transformers alerts close without manual dismissal"
      ],
      "failure_response": [
        "leave unavailable features documented and do not assume partial enablement"
      ]
    },
    {
      "id": "publish-analysis-archive",
      "system": "github",
      "authorization": "explicit_final_maintainer_approval",
      "disposition": "approval_ready",
      "operation": "push the annotated historical archive tag and publish its lightweight GitHub Release",
      "targets": [
        "songlab-cal/gpn@analysis-archive-2026-08-18",
        "tag object 312a6c70de6700e729bcea4c9a67ab42a72f05f7",
        "commit 30dee6cf45849dfdcfc043ca8baf44fd6ba51d74"
      ],
      "source": "release/analysis-archive.md",
      "depends_on": [
        "merge-modernization-stack"
      ],
      "preconditions": [
        "the archive manifest, annotated tag object 312a6c70de6700e729bcea4c9a67ab42a72f05f7, and peeled commit match the reviewed removal boundary",
        "the release text states that the archived code is historical and unsupported"
      ],
      "verification": [
        "the remote ref is object type tag with object ID 312a6c70de6700e729bcea4c9a67ab42a72f05f7 and peels to 30dee6cf45849dfdcfc043ca8baf44fd6ba51d74",
        "the GitHub Release links the maintained replacement recipes and documentation"
      ],
      "failure_response": [
        "do not rewrite a published archive tag; stop and request review before any corrective tag"
      ]
    },
    {
      "id": "publish-gpn-0-9-0",
      "system": "github",
      "authorization": "explicit_final_maintainer_approval",
      "disposition": "approval_ready",
      "operation": "publish GitHub Release v0.9.0 from the exact approved main commit, triggering the Trusted Publishing workflow",
      "targets": [
        "songlab-cal/gpn@v0.9.0",
        "https://pypi.org/project/gpn/0.9.0/"
      ],
      "source": "release/0.9.0/review.md",
      "depends_on": [
        "merge-modernization-stack",
        "protect-main",
        "publish-analysis-archive"
      ],
      "preconditions": [
        "the body of cumulative PR 100 records the exact approved tree and the maintainer repeats it in the approval",
        "the resulting main commit is recorded after squash merging and has exactly the approved tree",
        "the package version is exactly 0.9.0 and the tag target is the approved main commit",
        "the final review packet records a clean Python 3.13 install plus wheel and sdist hashes",
        "the release workflow and pypi environment are unchanged from the reviewed versions"
      ],
      "verification": [
        "the workflow publishes exactly one wheel and one source distribution with PyPI attestations",
        "a clean CPU install on Python 3.13 reproduces the documented package and model-registration smoke tests"
      ],
      "failure_response": [
        "never overwrite artifacts or reuse the version; stop downstream writes, document the incident, yank if appropriate, and prepare a patch release"
      ]
    },
    {
      "id": "publish-read-the-docs",
      "system": "readthedocs",
      "authorization": "separate_future_maintainer_approval",
      "disposition": "deferred",
      "operation": "import the repository and publish the reviewed Sphinx site after onboarding details are fixed",
      "targets": [
        "songlab-cal/gpn"
      ],
      "source": ".readthedocs.yaml",
      "depends_on": [
        "publish-gpn-0-9-0"
      ],
      "blocked_by": [
        "the maintainer must connect Read the Docs and select the exact public project slug"
      ],
      "preconditions": [
        "the final strict offline Sphinx build passes",
        "the exact public project slug is added to this ledger and reviewed"
      ],
      "verification": [
        "the public site renders the model, demo, API, research, citation, and release pages",
        "Read the Docs does not execute notebooks or download model/MSA assets"
      ],
      "failure_response": [
        "leave repository Markdown canonical and correct previews through a pull request"
      ]
    }
  ]
}
